{
  "btr_id": "BTR-BLUESKY-001",
  "derived_signals": {
    "flags": [
      "single-public-procurement-reference",
      "federal-procurement-reference"
    ],
    "manual_verification": false,
    "procurement_activity": true
  },
  "evidence_refs": [
    "EVID-BLUESKY-001"
  ],
  "identifiers": {
    "primary": "NG-BPP-47003",
    "secondary": [
      "FEDERAL-NOCOPO-2026-LAURMANN-COMPANY-LTD"
    ]
  },
  "jurisdiction": "NG",
  "legal_name": "Laurmann & Company Ltd",
  "public_links": [
    "https://data.open-contracting.org/en/publication/64"
  ],
  "record_state": "active",
  "trading_name": "Laurmann & Company",
  "updated_at": "2026-04-08T00:00:00Z"
}
