{
  "btr_id": "BTR-ACME-001",
  "legal_name": "Acme Procurement Services Ltd",
  "trading_name": "Acme Procurement",
  "jurisdiction": "NG",
  "identifiers": {
    "primary": "RC-123456",
    "secondary": [
      "TIN-ACME-001"
    ]
  },
  "public_links": [
    "https://example.com/businesses/acme-procurement-services"
  ],
  "evidence_refs": [
    "EVID-ACME-PROC-001",
    "EVID-ACME-PROC-002"
  ],
  "derived_signals": {
    "procurement_activity": true,
    "manual_verification": false,
    "flags": [
      "repeat-public-procurement-footprint",
      "multiple-public-award-references"
    ]
  },
  "record_state": "active",
  "updated_at": "2026-04-07T18:00:00Z"
}
