{
  "btr_id": "BTR-BLUESKY-001",
  "legal_name": "Blue Sky Catering Cooperative",
  "jurisdiction": "NG",
  "identifiers": {
    "primary": "RC-223344"
  },
  "public_links": [
    "https://example.com/businesses/blue-sky-catering"
  ],
  "evidence_refs": [
    "EVID-BLUESKY-001"
  ],
  "derived_signals": {
    "procurement_activity": false,
    "manual_verification": false,
    "flags": [
      "limited-public-evidence"
    ]
  },
  "record_state": "insufficient_evidence",
  "updated_at": "2026-04-07T18:00:00Z"
}
