{
  "btr_id": "BTR-LAGOON-001",
  "legal_name": "Lagoon Verification Partners Ltd",
  "jurisdiction": "NG",
  "identifiers": {
    "primary": "RC-998877",
    "secondary": [
      "VERIFIER-REF-2026-01"
    ]
  },
  "public_links": [
    "https://example.com/businesses/lagoon-verification-partners"
  ],
  "evidence_refs": [
    "EVID-LAGOON-001",
    "EVID-LAGOON-002"
  ],
  "derived_signals": {
    "procurement_activity": false,
    "manual_verification": true,
    "flags": [
      "manual-verification-reference"
    ]
  },
  "record_state": "active",
  "updated_at": "2026-04-07T18:00:00Z"
}
